{
  "schema_version": "0.1",
  "project_name": "ordivon-verify-quickstart",
  "mode": "standard",
  "receipt_paths": ["receipts"],
  "debt_ledger": "governance/verification-debt-ledger.jsonl",
  "gate_manifest": "governance/verification-gate-manifest.json",
  "document_registry": "governance/document-registry.jsonl",
  "output": "human"
}
