{
  "schema_version": "0.1",
  "project_name": "ctts2-deep-fixture",
  "pack": "coding",
  "profile": "ai_coding_trust_audit",
  "risk_stage": "release",
  "mode": "standard",
  "receipt_paths": ["receipts/external-audit-receipt.md"],
  "debt_ledger": "governance/verification-debt-ledger.jsonl",
  "gate_manifest": "governance/verification-gate-manifest.json",
  "document_registry": "governance/document-registry.jsonl"
}
